{
  "id":"iwork-universal","name":"iWork Universal","version":"0.1.1",
  "description":"Enhanced offline Apple iWork renderer for Pages, Numbers, and Keynote.",
  "minAppVersion":1,"entryClass":"ai.viewit.plugins.iworkuniversal.IworkUniversalPlugin",
  "supportedFormats":["pages","numbers","key"],
  "capabilities":["view","metadata","preview-images"],"base":"view","runtime":"native",
  "abi":"arm64-v8a","abiVersion":1,
  "downloadUrl":"https://omnia.mihirpatil.co/plugins/iwork-universal-0.1.1-arm64-v8a.zip",
  "sizeBytes":0,"installedSizeBytes":0,"checksum":""
}
