{
  "id": "font-universal",
  "name": "Font Universal Plugin",
  "version": "0.1.0",
  "description": "Font metadata viewer for TTF, OTF, WOFF, WOFF2, TTC, and other font formats",
  "minAppVersion": 1,
  "entryClass": "ai.viewit.plugins.fontuniversal.FontUniversalPlugin",
  "supportedFormats": [
    "ttf", "otf", "woff", "woff2", "pfb", "cff", "dfont", "sfd", "ps", "ttc"
  ],
  "capabilities": ["document-render"],
  "downloadUrl": "",
  "sizeBytes": 0,
  "installedSizeBytes": 0,
  "checksum": "",
  "abi": "arm64-v8a",
  "abiVersion": 1,
  "runtime": "native"
}
