{
  "id": "ffmpeg-transcoder",
  "name": "FFmpeg Transcoder",
  "version": "1.0.5",
  "description": "Adds transcoding support for unsupported video and audio formats. Converts legacy containers/codecs to MP4 using FFmpeg.",
  "minAppVersion": 1,
  "abiVersion": 1,
  "entryClass": "ai.viewit.plugins.ffmpeg_transcoder.Plugin",
  "capabilities": ["media.inspect", "media.convert"],
  "runtime": "android-dex-jni",
  "abi": "arm64-v8a",
  "supportedFormats": ["avi", "mkv", "mov", "webm", "3gp", "flv", "asf", "wmv", "wma", "swf", "mxf", "mpg", "mpeg", "ts", "m2ts", "mts"],
  "downloadUrl": "https://omnia.mihirpatil.co/plugins/ffmpeg-transcoder-1.0.5.zip",
  "sizeBytes": 0,
  "installedSizeBytes": 0,
  "checksum": ""
}
