{
  "id": "office-ooxml",
  "name": "Enhanced Office OOXML",
  "version": "0.3.0",
  "description": "Optional enhanced DOCX/XLS/XLSX/PPTX runtime with plugin-owned offline HTML renderers and a calamine spreadsheet engine.",
  "minAppVersion": 1,
  "abiVersion": 1,
  "entryClass": "ai.viewit.plugins.office_ooxml.Plugin",
  "capabilities": ["view", "inspect", "edit-planned"],
  "runtime": "android-dex-rust-sidecar",
  "supportedFormats": ["docx", "xlsx", "xls", "pptx", "docm", "xlsm", "pptm"],
  "downloadUrl": "https://github.com/mihir0209/ViewIt/releases/latest/download/office-ooxml-0.3.0.zip",
  "sizeBytes": 18848714,
  "installedSizeBytes": 53884490,
  "checksum": ""
}
